input,output
Vis | eat | Barba | Komiza,Nice restaurant in Komiza with food cooked on wooden fire.
"Vis | eat | Jastozera | Pricey, Komiza",Pricey lobster house in the town of Komiza.
Vis | eat | Bako | Komiza,"Very cosy place in the town of Komiza. Food is quite good, prices are in the averace. The terrace is really nice, so close to the sea that you can really feel it."
"Vis | eat | Plaza | Komiza, Komiza","is one of the best, and cheapest!, pizzeria in the town of Komiza. It is located in the town of Komiza near the hotel and the main beach. Prices are around 70 kuna for a meal and the food is rather good."
"Vis | eat | Dionis | Italian, Dalmatian",serves great Italian and Dalmatian food at reasonable prices. Try the calamari risotto!
Vis | eat | Kolderaj | ,is a small bakery at the coast where you can get coffee and tea as well.
"Zadar | other | Zračna luka Zadar | Croatia Airlines, Ryanair, season","The airport shares its airfield with military. It used to be a civic road crossing its taxi lanes, so the traffic was regulated by lifting gates, but it doesn't seem the case anymore. Nevertheless it's an international airport with flights by Croatia Airlines, Eurowings, Ryanair, and few others; various charters in season."
Zadar | other | Airport shuttle | ,The bus runs to the city's bus station and then continues up to the bus hub at the old town.
Zadar | eat | Hungry Eyes | Specialized,"Specialized in grilled meat and fish. Large portions, fast service, competitive prices. Suitable for large groups and lunch or dinner with kids. Outside the old town, reachable by public transport (bus 8 Diklo - Kolodvor)."
Zadar | eat | Mijo | Italian,"Italian restaurant specialized in sea food, pizzas and pasta. Outside the old town, but close to a Borik. A romantic restaurant offering dining inside and outside, great for couples but not for families with kids. Large portions for fair prices."
"Zadar | drink | Cocktail Bar Mango | the early evening, the busy summer months","Lounge bar with a view over the bay. Large selection of alcoholic and non-alcoholic drinks. Comes to life in the early evening, only during the busy summer months."
"Zadar | drink | The Garden | Bedemi, James Brown, Garden","''Bedemi zadarskih pobuna'', ]. A fancy open bar with a lovely view over the harbour, opened by UB40 drummer James Brown. The Garden also hosts an annual electronic music festival."
"Zadar | drink | The Arsenal | Bunara, A 17th century, Venetian Naval Warehouse, Restaurant-Bar-Club","Trg tri Bunara. A 17th century. Venetian Naval Warehouse, now a cool Restaurant-Bar-Club."
Zadar | sleep | Hotel Kolovare | ,The only hotel close to the city center.
Zadar | sleep | Youth Hostel | ,Friendly.
Zadar | sleep | Hotel Adriatic | ,"3 star designer hotel, great pool."
Zadar | sleep | Hostel Ljepotica | ,friendly
"Zadar | sleep | Falkensteiner Hotel & Spa | Falkensteiner Hotel &Spa, Zadar, Punta, Salka","Falkensteiner Hotel &Spa is a five star hotel, located north of Zadar in Punta Salka peninsula."
Zagreb | other | Turistički informativni centar | ,
Zagreb | other | Zračna luka Zagreb | ,The 2nd terminal is under construction.
"Zagreb | other | Pleso prijevoz | 07:00, every 30 minutes, between 08:00 and 20:00, these hours, Croatia Airlines, between 04:30 and 20:30","Buses leave the airport at 07:00 and every 30 minutes between 08:00 and 20:00. Beyond these hours, there are buses leaving for the bus station every time a Croatia Airlines plane lands. In the opposite direction, from the bus station towards the airport, the buses are scheduled between 04:30 and 20:30. A journey takes approx. 30 min."
"Zagreb | other | Autobusni Kolodvor Zagreb | AKZ, Croatian, International, European",Timetable information and prices can be found at the AKZ website. Numerous Croatian and International coach operators maintain scheduled lines covering all major domestic and European cities.
Zagreb | other | Left luggage | ,
"Zagreb | other | Zagreb Glavni kolodvor | European, Vienna, 6 hours, Budapest, 6.5 hours, HUF, Zurich, Munich, Salzburg, Ljubljana, Sarajevo, Belgrade, Dubrovnik, all-year-round, Zagreb, Split, 6 hours","There are direct services to major European cities such as Vienna (6 hours), Budapest (6.5 hours, one way approx. 9,000 HUF), Zurich, Munich, Salzburg, Ljubljana, Sarajevo (one-way ticket costs 59 BAM), Belgrade as well as domestic services to all major towns (except Dubrovnik). There is also an all-year-round overnight train (with sleeping compartments) between Zagreb and Split (6 hours)."
"Zagreb | see | Zagreb Cathedral | The Zagreb Cathedral, 1217, 1906, Hermann Bollé",The Zagreb Cathedral with its twin spires is the most well known landmark of the city. The original cathedral dates back to 1217 but the present structure dates back to 1906. The chief architect was Hermann Bollé.
"Zagreb | see | St. Mark's Square | St. Mark's, Square, St. Mark's, Croatia, Zagreb, St. Mark's, 1499","Located at the centre of St. Mark's Square, St. Mark's Church is known for its colourful roof tiles depicting the coat of arms of Croatia and Zagreb. St. Mark's Church was constructed in 1499."
Zagreb | see | St. Catherine's Church | ,Baroque style church
"Zagreb | see | Old Town Gate | Kamenita, Gate, Mary, St. George, the Croatian National Theatre","now a shrine to virgin Mary - the '''""Kamenita vrata""''' where you can light a candle and, as the locals believe, your wish will be granted. Please be silent, even if just passing through the Gate. The portrait of Mary is said to be sacred, because it is the only thing that survived the large fire. Near the Old Town Gate is the sculpture of St. George having slain the dragon. The other statue, him fighting the dragon, is located on the Marshal Tito's Square near the Croatian National Theatre (roughly 1 km away)."
"Zagreb | see | Ribnjak Park | Ribnjak, Bishop","the Ribnjak is an English-style park complete with exotic plants, sculptures, and a children's playground. The park was originally the site of Bishop's fish pond."
"Zagreb | see | Museum of Broken Relationships (Muzej prekinutih veza) | Museum's, Kenneth Hudson Award 2011, Europe",What remains after a break-up? Museum's permanent display is an opportunity to experience a unique emotional journey through dozens of love leftovers collected from all around the world. Museum is also the winner of Kenneth Hudson Award 2011 for the most innovative museum in Europe.
"Zagreb | see | Klovićevi Dvori Gallery | Jesuit, Croatian","This gallery in the old Jesuit monastery with changing exhibitions introduces Croatian and foreign cultural and artistic heritage across all eras. In most exhibitions, photography without flash is permitted."
"Zagreb | see | Strossmayer Square | Josip, Juraj Strossmayer, Roman Catholic Bishop, Strossmayer Square, the Lenuci Horseshoe","Named after Josip Juraj Strossmayer, politician and Roman Catholic Bishop, the Strossmayer Square occupies the central position of the eastern wing of the Lenuci Horseshoe."
"Zagreb | see | Zrinjevac Square | Academy, Zrinjevac, Tomislav",the park of the Academy (connecting the Zrinjevac and Tomislav parks).
"Zagreb | see | King Tomislav Square | Tomislav Square, Glavni Kolodvor, Zagreb, Tomislav",King Tomislav Square is the square overlooking the main railway station (Glavni Kolodvor ) of Zagreb. Decorated with floor beds and fountains and lined with trees it is dominated by a horse mounted statue of King Tomislav.
Zagreb | see | Botanical Gardens | ,
"Zagreb | see | Mažuranić Square | Lenuci Horseshoe, Croatian, Ivan Mažuranić",The central square of the western wing of Lenuci Horseshoe. It is named after Croatian poet Ivan Mažuranić
"Zagreb | see | Marulić Square | South Western, Lenuci Horseshoe, the Croatia State Archive, Marko Marulić",Marulić Square is the South Western square of Lenuci Horseshoe. It houses the Croatia State Archive. It also has a statue of Marko Marulić.
"Zagreb | see | Square of Maršal Tito | Zagreb, North Western, Lenuci Horseshoe, the Croatian National Theatre",One of the largest and greenest squares of Zagreb. It is located on the North Western corner of Lenuci Horseshoe. It has the Croatian National Theatre in its centre.
"Zagreb | see | Muzej Mimara (Mimara Museum) | Ante Topić Mimara, the 20th century, Lorenzetti, Raffaello, Giorgione, Veronese, Caravaggio, Canaletto, Dutch, Rembrandt, Van Goyen, Ruisdael, Flemish, Van der Weyden, Bosch, Rubens, Van Dyck, Spanish, Velasquez, Murillo, Goya, German, Holbein, Liebermann, Leibl, English, Turner, Bonington, French, Georges de la Tour, Boucher, Chardin, Delacroix, Corot, Manet, Renoir, Degas","Houses some 3,700 works of art donated by Ante Topić Mimara. The collection comprises more than 1,500 exhibits dating from the prehistoric period up to the 20th century. Some of the most famous exhibits include works by Lorenzetti, Raffaello, Giorgione, Veronese, Caravaggio, Canaletto, 60 paintings by the Dutch masters Rembrandt, Van Goyen, Ruisdael, 50 works by the Flemish masters Van der Weyden, Bosch, Rubens, Van Dyck, more than 30 by the Spanish masters Velasquez, Murillo, Goya, some 20 paintings by the German masters Holbein, Liebermann, Leibl, some 30 paintings by the English painters Gainsborough, Turner, Bonington and more than 120 paintings by the French masters Georges de la Tour, Boucher, Chardin, Delacroix, Corot, Manet, Renoir, Degas."
"Zagreb | see | Archaeological Museum | Croatian, Egyptian, Zagreb, Etruscan, Liber Linteus Zagrabiensis, Roman","Possesses over 400,000 objects, not all of them being exhibited. The holdings include evidence of Croatian presence in this area as well as rare samples which have made the museum known to the whole world. The most famous are the Egyptian collection, the Zagreb mummy and bandages with the oldest Etruscan inscription in the world (Liber Linteus Zagrabiensis), as well as the numismatic collection. A part of the museum is set aside for the collection of stone monuments dating back predominantly to the Roman period."
"Zagreb | see | Art Pavilion in Zagreb | Hungarian, Korb, the Millennium Exhibition 1896, Budepest, Zagreb, Viennese, Central Europe Hellmer, Fellmer, Trg, Meštrović, Zagreb, Rodin, Rodin, Paris, Rodin","Designed by the Hungarian architects Korb and Giergl for the Millennium Exhibition 1896 in Budepest, its iron frame was transported to Zagreb after the exhibition, where the permanent pavillion was built by the famous Viennese designers of theatres in Central Europe Hellmer and Fellmer. It is a neo-classical exhibition complex and one of the landmarks of the city center. The exhibitions are also held in the impressive Meštrović pavilion on Trg žrtava fašizma. Current exhibition: Auguste Rodin - Rodin in Meštrović's Zagreb (until 20-Sep-2015), showing 55 large and small sculptures, 2 paintings and 10 scetches by Rodin and 10 early photographs of Rodin's work by then-famous photographers. Photography is not permitted by order of the Rodin museum in Paris despite the fact that Rodin's work is now in the public domain."
"Zagreb | see | Croatian National Theatre | Croatian National Theatre, Zagreb, 1895, Croatian National Theatres, Split, Rijeka, Varaždin, Zadar","Croatian National Theatre, Zagreb is located at the centre of Marshal Tito Square. It is built in 1895. There are also Croatian National Theatres in Split, Rijeka, Osijek, Varaždin and Zadar."
Zagreb | see | Moderna Galerija (Modern Gallery) | the 19th and 20th centuries,Comprises all relevant fine artists of the 19th and 20th centuries.
"Zagreb | see | People and Art House Lauba (Kuća za ljude i umjetnost Lauba) | the Filip Trade Collection, Croatian","Presents works from the Filip Trade Collection, a large private collection of modern and contemporary Croatian art and current artistic production."
Zagreb | see | Technical Museum | Nikola Tesla,"Has a lot of technical inventions, fire engines, a cabinet of Nikola Tesla, a planetarium and an underground mine."
"Zagreb | see | The Grounded Sun | Prizemljeno, Ivan Kožarić, 1971, Sun, Sun, Mercury, Margaretska, Cvjetni, Earth, Varšavska","Prizemljeno sunce by Ivan Kožarić is a 1971 sculpture, a 2 meter wide bronze sphere, which represents the scale model of the Sun, with 9 planets of the solar system in their scaled size compared to this Sun. Mercury is in Margaretska street, a couple of hundred meters to the west, turn right after reaching Cvjetni trg, you should see it on the wall to the right after passing a dozen or so meters. Venus is on the pole of the building with Hypo bank on the Ban Jelačić Square. Earth is in Varšavska street to the left. For other models, click the link of the sculpture above."
"Zagreb | see | Maksimir Park & Zagreb Zoo | Zagreb, 85-year old","The biggest park in Zagreb. Great place to chill out, drink coffee, eat lunch (picnic or at the park's restaurant) or take nice long walks through the forest or by the small lakes. Good for joggers, cyclists, also child and dog friendly. Offers lake rowing. The 85-year old zoo has red pandas."
"Zagreb | see | Mirogoj Cemetery | Mirogoj, Zagreb, 1876, H. Bollé, 1883-1914, Drazen Petrovic, Croatian, Cathedral, Kaptol - Mirogoj - Krematorij, approximately 10 minutes, the Croatian Day, Dead, November 1st, that day, days, those days","Mirogoj is the central cemetery of Zagreb. It was opened in 1876 north of the city center. The mortuary, the impressive and picturesque arcades with the church of Christ the King (architect H. Bollé, 1883-1914) make it one of the most impressive cemeteries in the world. Here stand the tombs of notable personalities (including that of basketball hero Drazen Petrovic) who are relevant to Croatian history. To arrive from the central square, go to the nearby Cathedral and take bus number 106 (Kaptol - Mirogoj - Krematorij). The ride takes approximately 10 minutes. Note: the Croatian Day of the Dead is on November 1st. You may find the sight of hundreds of thousands of candles after nightfall impressive and worth seeing, but you may take note that on that day and a few preceding and following days the cemetery will be very busy and quite different from usual peaceful appearance; on those days buses to the cemetery are very frequent but crowded."
"Zagreb | see | Medvednica and Medvedgrad | Zagreb, Medvednica, Medvedgrad, Homeland, Croatian, the year, Jun 2015","The imposing mountain overlooking Zagreb (Medvednica) contains a preserved fortress (Medvedgrad) and fascinating views of the city. Being respectful in the fort is a good idea, since it is the site of the Altar of the Homeland memorial, dedicated to Croatian soldiers who died in the Homeland war. There are several historical festivals during the year, including knights tournaments. (updated Jun 2015)"
Zagreb | see | Jarun | Jarun Lake,"Jarun Lake is a recreational area based around a large lake where locals go to relax, exercise - and party! The centerpiece of the area is the actual lake itself, which is used for windsurfing and has a large rowing section with spectator stands. There are also shingle beaches surrounding the water, alongside which are several bars that get very busy during the weekends but are also nice for a sunny lunchtime snack. All the bars there are considered 'fancy' places and usually play commercial music."
Zagreb | see | Bundek | the summer,"hosts horticultural shows, firework festivals, workshops, concerts and music festivals (mostly during the summer)."
Zagreb | see | Museum of Contemporary Art | ,Follows and presents contemporary trends in fine arts.
Zagreb | see | Croatian Museum of Naïve Art | Croatian,Houses more than one thousand works belonging to Croatian naïve art.
"Zagreb | do | Strossmayerovo šetalište | Strossmayer, the summer, the Lower Town","(eng. Strossmayer's walkway) In the summer, it is an outdoor scene for painters, musicians and other artists offering food, drinks, performances and concerts. Popular meeting place for all ages, with a great view of the Lower Town."
"Zagreb | do | Snow Queen Trophy | Zagreb, World Cup, Snježna, January, Croatia, 2007, Mount Sljeme","Ladies Night Slalom : Zagreb is the only capital in the world that hosts a Ski World Cup race. The slalom event - known as the ""Snow Queen Trophy"" (Snježna kraljica) - usually takes place in January. It is the most expensive race on the women's world cup tour and an exceptionally popular sporting event in Croatia that attracts a crowd of around 25 thousand people. As of 2007 best skiers in men's competition are also expected to compete on Mount Sljeme that overlooks the city. If you fail to secure your ticket, you can watch the whole event on a giant screen in the Ban Jelačić Square."
"Zagreb | do | CineStar Zagreb | the Sheraton Hotel, Croatian, Croatian","A multiplex cinema (13 screens) in the vicinity of the Sheraton Hotel. The website is in Croatian, but can be understood using a Croatian-English online dictionary."
Zagreb | do | CineStar Novi Zagreb | the Museum of Contemporary Art,A multiplex cinema (9 screens) in the vicinity of the Museum of Contemporary Art.
"Zagreb | do | Cineplexx Centar Kaptol | the Kaptol Shopping Center, Cathedral",A multiplex cinema (5 screens) within the Kaptol Shopping Center situated to the north of the Cathedral.
Zagreb | do | Cineplexx City Center one East | Zagreb,A multiplex cinema (7 screens) located on the east side of Zagreb.
"Zagreb | do | Kino Tuškanac | European, HRK","Showing much more than just European filmography, alternative and older films, sometimes for free, usually costs about 10 HRK (€1.50)"
Zagreb | buy | Turistički Informativni Centar | ,Sells everything ranging from postcards and books to pottery and crystal
Zagreb | buy | GEA Gallery | Croatia,a wide range of souvenirs that are handmade in Croatia and are very reasonably priced. Very knowledgeable staff.
Zagreb | buy | Millennium | ,"Pottery, crystal, costume jewelery, and other gifts."
Zagreb | buy | Algoritam | ,
Zagreb | buy | Profil Megastore | ,
Zagreb | eat | American Doughnut | ,A sandwich bar that also serves salads and deserts.
Zagreb | eat | Baschiera 2 | ,Pizza.
Zagreb | eat | Bonita | the winter,Popular sandwich bar that also serves pancakes and hot wine in the winter.
Zagreb | eat | Colonia | ,Pizza.
Zagreb | eat | Dvojka | ,Pizza.
Zagreb | eat | Gigi | ,Be sure to visit this pizzeria if you're going to the Jarun lake.
Zagreb | eat | Karijola | ,Pizza.
"Zagreb | eat | Koykan World Food | Italian, Japanese, Taiwan, Japanese","Italian piadinas, Japanese teriyaki sticks, oriental wraps, Bubble tea from Taiwan and Japanese mochi cakes."
Zagreb | eat | Mamma Mia | ,Pizza.
Zagreb | eat | MOCA | ,"Newly open at the main square serves great and cheap fried, deep fried and baked potatoes with a large variety of dips for takeout."
Zagreb | eat | Nocturno | ,Pizza.
Zagreb | eat | Nova | Vegetarian,Vegetarian.
Zagreb | eat | Oliva | Italian,"Italian restaurant (pizza, pasta)"
Zagreb | eat | Pizza Cut Duck | veggie and/or meat filling,A pizza-slice bar that also serves fresh tortillas with veggie and/or meat filling.
Zagreb | eat | Pyr | Vegetarian,Vegetarian.
Zagreb | eat | Robin Food Catering | Vegetarian,Vegetarian.
Zagreb | eat | Sandwich Bar Pingvin | toplo/hladno,"Classic sandwich bar with a wide menu and reasonably good mix of languages. One of the most popular dishes is the toplo/hladno (hot/cold), a grilled chicken and vegetables sandwich."
Zagreb | eat | Šestica | ,Pizza.
Zagreb | eat | Stara Sava | Zagreb,Arguably the best pizzeria in Zagreb.
Zagreb | eat | VegeHop | Vegetarian,Vegetarian.
"Zagreb | eat | Žirafa | Cheap Mexican, summer",Cheap Mexican food and drinks. Nice summer terrace.
"Zagreb | eat | Royal India | Aug. 2013, Royal India, Indian Dishes",Opened in Aug. 2013 Royal India serves authentic Indian Dishes.
Zagreb | eat | Asia | Chinese,Chinese restaurant
Zagreb | eat | Caramba | Mexican,Mexican food.
Zagreb | eat | Ivica i Marica | ,"Wonderful food made only from natural ingredients, many sourced locally."
"Zagreb | eat | Mali Medo | Croatian, gulaš","Another traditional Croatian restaurant. Lively atmosphere, youthful clientele, and all very affordable. Excellent ćevapčići and gulaš, not to mention superb beer."
"Zagreb | eat | Manzoku | Japanese, Zagreb",An excellent and so far only Japanese take-out in Zagreb. Tasty but rather expensive.
"Zagreb | eat | Mex Cantina | Mexican, Mondays, Croatian, Los Caballeros","Mexican food. Good service, great food, on Mondays they offer live music by the best Croatian mariachi band, Los Caballeros starting at 9PM."
Zagreb | eat | Pivnica Medvedgrad | ,Great food and beer for reasonable prices. Make sure to try 'čvarkuša' (4 HRK).
"Zagreb | eat | Restaurant Kvatric | Croatian, Kvaternikov Trg'",Croatian restaurant with very nice food for a reasonable price. Has a nice terrance in the back garden. Close to tramstop 'Kvaternikov Trg'.
Zagreb | eat | Boban | Italian,Italian food.
Zagreb | eat | Feniks | Mexican,Mexican food.
"Zagreb | eat | Le Bistro | French, the Regent Esplanade Hotel",A French restaurant within the Regent Esplanade Hotel..
"Zagreb | eat | Panino | French, Istrian",Nice little restaurant with great service and wonderful food. If you are into French and Istrian style food you will probably love this place.
Zagreb | eat | Restaurant Suhina | Samobor,An old family-run restaurant on the old Samobor road that offers a variety of roasted food.
Zagreb | eat | Srčeko | ,A very romantic little restaurant.
Zagreb | eat | Takenoko | Zagreb,"Zagreb may not be synonymous with sushi restaurants, but this is one is superb. It is not cheap, but sushi they make is incredible."
Zagreb | eat | Velika Klet Obitelji Bunčić | Croatian,"A very popular place that offers Croatian cuisine, live music on weekends, a stable, fish pond and basketball courtyard."
Zagreb | eat | 100% juice bar | Pricey,Pricey but a good place to get a healthy snack or fruit smoothie.
Zagreb | eat | Ivica and Marica | ,"Offers traditional and diet, diabetic and organic cakes, ice creams and such."
Zagreb | eat | SladoMazo | ,A pancake restaurant with a wide range of crazy both sweet and satly filling ideas.
Zagreb | eat | The Cookie Factory | ,"Homebaked American Sweets. Cookies, brownies and bars, krispy treats, muffins, cupcakes, banana breads, scones, cobblers, biscotti, top notch coffee, smoothies, cakes and pies."
Zagreb | eat | Torte i To | ,"A great little caffe offering the best cheese cake in town, and other great cakes"
Zagreb | eat | Vincek | ,"The local, best known ice cream and cake palace in town center. Offers diet foods."
Zagreb | eat | Konoba Didov San | Zagreb,"The best atmosphere restaurant in Zagreb with excellent food, unique menu, large portions and great location!!"
"Zagreb | eat | Nishta Restaurant | Vegetarian, Dubrovnik","100 % Vegetarian food, also has a branch in Dubrovnik"
Zagreb | drink | Booksa | ,A cafe/bookshop/library famous with local young intelectuals.
Zagreb | drink | Harlekin | Cozy,"Cozy atmosphere, excellent English, free Wi-Fi, delicious drinks, very reasonable prices, great coffee, DJ or live music on weekends."
Zagreb | drink | Cica | ,"Bar mostly known for its great and varied choice of the local schnappses (rakija). Interesting always changing, gallery-like interior. The whole bar is small but offers outdoor seating. Very popular and crowded, brimming with young business and student clientele."
"Zagreb | drink | Funk club | Rakija, electro","Cafe / bar that offers various music night programmes in the basement (mostly alternative, dj-s, world music) and spacial backpacker evenings. Very good atmosphere, lots of character, cheap and tasty Rakija shoots and excellent electronic music: funky, electro, jazz, d'n'b, house, dubstep."
Zagreb | drink | Golf | ,Popular golf-themed cafe/bar.
Zagreb | drink | KIC | ,Offers free internet and cheap international call center. Hosts a cinema with various alternative movies.
Zagreb | drink | Kino Grič | Zagreb,"Newly re-decorated old cinema. Hosts movies, festivals, music nights and Zagreb's hipster crowd."
Zagreb | drink | Krivi Put (Wrong Way) | ,
Zagreb | drink | Mali Medo | ,Offers a good choice of local beer and food. Indoors smoking prohibited. Has a terrace facing Tkalčićeva street.
Zagreb | drink | Melin | ,"A cheap bar brimming with young people and students. Offers indoors, a roofed terraced leveled seating and an open terrace facing Tkalčićeva street. Known for crowds of people often drinking even around the bar, in the park and playground in front of it."
"Zagreb | drink | Oliver Twist | Irish, summer",A choice of good Irish beer with a great atmosphere. Big summer terrace in front.
Zagreb | drink | Pivnica Medvedgrad | ,
Zagreb | drink | Bar Plan B | ,"A cafe/wine bar/sports bar. Attracts a mix of locals and tourists. You can expect music from every genre, and decade, from Jazz to Alternative/Indie."
"Zagreb | drink | Portal | Melin, Portal, Melin","Next to Melin, offers same service, the Portal and Melin crowds often mix at the outdoors terraces."
"Zagreb | drink | Purgeraj | Ribnjak, Daily, Thursdays, evening, the summer, Purgeraj, Ribnjak, summer, Zagreb","A bar/club located in the Ribnjak park in the city center. Offers mostly rock, blues and alternative music. Daily happy hour when you get two drinks for the price of one. Sometimes hosts concerts. Popular with student crowd esp on Thursdays when it hosts the newly popular ""take me out"" evening offering a mix of indie and alternative music. In the summer, outside Purgeraj, in the Ribnjak park there are live concerts and various workshops offering summer fun under the name 'Park In Zagreb'."
Zagreb | drink | Tolkien's House | Tolkien,"A small fantasy cafe/bar for Tolkien lovers. Offers a variety of beers, cider and hot drinks."
